Fresh Bananas,Fruit & Veggies
Shepard Avocados,Fruit & Veggies
Fresh Strawberries Prepacked,Fruit & Veggies
Continental Cucumbers,Fruit & Veggies
Carrots Prepacked,Fruit & Veggies
Raspberries,Fruit & Veggies
White Seedless Grapes,Fruit & Veggies
Broccoli,Fruit & Veggies
Greenhouse Truss Tomatoes,Fruit & Veggies
Blackberries Prepacked,Fruit & Veggies
Blueberries Prepacked,Fruit & Veggies
Red Capsicum,Fruit & Veggies
Field Tomatoes,Fruit & Veggies
Green Zucchini,Fruit & Veggies
Seedless Watermelon Cut,Fruit & Veggies
Baby Cos Lettuce,Fruit & Veggies
Royal Gala Apples,Fruit & Veggies
Sweet Corn,Fruit & Veggies
Fresh Brown Onions,Fruit & Veggies
Red Seedless Grapes,Fruit & Veggies
Sweet Gold Potatoes,Fruit & Veggies
Iceberg Lettuce,Fruit & Veggies
Yellow Nectarines,Fruit & Veggies
Grape Perino Tomatoes Prepacked,Fruit & Veggies
Spring Onions,Fruit & Veggies
White Nectarines,Fruit & Veggies
Lebanese Cucumbers,Fruit & Veggies
Fresh Medium Navel Oranges,Fruit & Veggies
Brown Onions,Fruit & Veggies
Red Onions,Fruit & Veggies
Fresh Cup Mushrooms,Fruit & Veggies
Pink Lady Apples,Fruit & Veggies
Baby Cucumbers,Fruit & Veggies
Carrots,Fruit & Veggies
Keitt Mangoes,Fruit & Veggies
Creme Gold Washed Potatoes,Fruit & Veggies
Green Beans,Fruit & Veggies
Green Capsicum,Fruit & Veggies
Baby Broccoli,Fruit & Veggies
Kids Pack Bananas,Fruit & Veggies
Red Onion,Fruit & Veggies
Cherry Tomatoes Prepacked,Fruit & Veggies
Yellow Peaches,Fruit & Veggies
Lettuce Spinach,Fruit & Veggies
Rockmelon Whole,Fruit & Veggies
Green Beans Prepacked,Fruit & Veggies
Baby Spinach,Fruit & Veggies
Kent Pumpkin Cut,Fruit & Veggies
White Peaches,Fruit & Veggies
Black Plums,Fruit & Veggies
Royal Gala Apples,Fruit & Veggies
Fresh Granny Smith Medium Apples,Fruit & Veggies
Grape Mini Roma Tomatoes,Fruit & Veggies
William Bartlett Pears,Fruit & Veggies
Wrapped Butternut Pumpkin,Fruit & Veggies
Cauliflower Medium,Fruit & Veggies
4 Leaf Salad Mix,Fruit & Veggies
Baby Carrots Prepacked,Fruit & Veggies
Creme Royale Brushed Potatoes,Fruit & Veggies
Garlic,Fruit & Veggies
Black Grapes,Fruit & Veggies
Green Asparagus,Fruit & Veggies
Celery,Fruit & Veggies
Sliced Mushrooms,Fruit & Veggies
Ginger,Fruit & Veggies
Red Royale Potatoes,Fruit & Veggies
Fresh Purple Eggplant,Fruit & Veggies
Cup Mushrooms,Fruit & Veggies
Asian Choy Pak,Fruit & Veggies
Wonder White Bread Wholemeal Plus Iron,Bakery
Genius Gluten Free Soft Brioche Rolls,Bakery
Genius Gluten Free Farmhouse Soft Brown Bread Loaf,Bakery
Genius Gluten Free Triple Seeded Soft Rolls,Bakery
Noshu 95% Sugar Free Iced Carrot Cakes,Bakery
Noshu 97% Sugar Free Iced Funtella Cakes,Bakery
Toscano Traditional Butter Waffles 4 pack,Bakery
Toscano Chocolate Crepes,Bakery
Toscano Choco Chip Waffles 4 pack,Bakery
Toscano Mini Waffles,Bakery
Bakery Flatbread White,Bakery
Bakery Pancakes,Bakery
Hot Cross Buns Traditional Fruit,Bakery
White Bread,Bakery
Wonder White Bread + Vitamins & Mineral,Bakery
Bakery Flatbread Wholemeal,Bakery
Bakery Super Soft Round Rolls,Bakery
Tip Top The One White Sandwich Bread,Bakery
Tip Top The One White Toast Bread,Bakery
Soft Wholemeal Sandwich Loaf,Bakery
Hot Cross Buns Chocolate,Bakery
Bakery Croissants 3 Pack,Bakery
Hot Cross Buns Apple And Cinnamon,Bakery
Helga's Traditional Wholemeal Bread,Bakery
Turkish Rolls 4 pack,Bakery
High Fibre Wholemeal Bread,Bakery
Golden Round Crumpets,Bakery
Wonder White Bread + Vitamins Toast,Bakery
Bakery Stone Baked By Laurent Pane Di Casa,Bakery
Soft White Toast Loaf,Bakery
Bakery Croissants 4 Pack,Bakery
Bakery Vegemite Scroll,Bakery
Deli Fresh Tasmanian Salmon Portions Skin On,Deli
RSPCA Approved Whole Chicken Roast,Deli
Don Virginian Leg Ham Sliced,Deli
Deli RSPCA Approved Chicken Breast Fillets,Deli
Primo Champagne Leg Ham,Deli
Deli Don Kabana,Deli
Don White Hungarian Salami,Deli
Primo Middle Bacon Rind On,Deli
Bertocchi Natural Hickory Smoked Leg Ham,Deli
Ham On The Bone,Deli
Deli RSPCA Approved Chicken Thigh Fillets,Deli
Bertocchi Triple Smoked Leg Ham,Deli
Primo Short Cut Bacon,Deli
Deli Thawed Raw Peeled Prawn Meat,Deli
Deli Thawed Raw Black Tiger Prawns,Deli
Primo Red Gum Honey Leg Ham,Deli
Deli Express Giant Pitted Kalamata Olives,Deli
Lilydale Chicken Sage & Onion Roast,Deli
Silverside,Deli
Thawed Seafood Marinara Mix,Deli
Primo Deli Express Chicken Frankfurt,Deli
Arnott's Original BBQ Shapes,Pantry
Nestle Mini Egg Bag,Pantry
Sanitarium Weet-Bix Bites Wild Berry Cereal,Pantry
Arnott's Multipack Biscuits Tim Tam,Pantry
Arnott's Tiny Teddy Variety Biscuits 15 pack,Pantry
Passage Foods Passage To India Balti Curry Simmer Sauce Pouch,Pantry
Passage Foods Passage To India Tikka Masala Simmer Sauce Pouch,Pantry
Snickers Chocolate Bar Peanuts Caramel Nougat,Pantry
Arnott's Original Pizza Shapes,Pantry
Arnott's Original Savoy Crackers,Pantry
Indomie Fried Mi Goreng Instant Noodles 5 Pack,Pantry
Doritos Corn Chips Supreme Cheese Share Pack,Pantry
Sanitarium Weet-Bix Breakfast Cereal,Pantry
Nestle KitKat Milk Chocolate Bar,Pantry
Italian Diced Tomatoes,Pantry
Arnott's Chicken Crimpy Shapes,Pantry
Ultimate Cookies 40% Chocolate Chip,Pantry
Kettle Chilli Potato Chips,Pantry
Arnott's Original Salada,Pantry
Kettle Sea Salt Potato Chips,Pantry
Arnott's Original Chocolate Tim Tam,Pantry
Cadbury Dairy Milk Chocolate Block,Pantry
The Natural Confectionery Co Snakes,Pantry
Tyrrells Hand Cooked Lightly Salted Crisps,Pantry
Chick Peas,Pantry
Arnott's Cheddar Shapes,Pantry
John West Tempters Chilli Tuna,Pantry
CC's Tasty Cheese Corn Chips,Pantry
Pringles Sour Cream & Onion Potato Chips,Pantry
Frozen Fruit Mixed Berries,Frozen
Weis Mini Mango Fruit Ice Bars 8 pack,Frozen
Weis Mango Ice Cream Bars 4 Pack,Frozen
Weis Mango & Macadamia Ice Cream Bars 4 pack,Frozen
Streets Paddle Pop Rainbow,Frozen
Streets Paddle Pop Chocolate,Frozen
Streets Paddle Pop Banana,Frozen
Haagen Dazs Signature Collection Ice Cream Mini Cups 4 Pack,Frozen
Birds Eye Frozen Fish Fillets With Original Lightly Battered Oven Bake 6 Pack,Frozen
Birds Eye Frozen Fish Fillets With Lemon Crumb Oven Bake 6 pack,Frozen
Luv A Duck Frozen Whole Duck,Frozen
Streets Blue Ribbon Vanilla Ice Cream Tub,Frozen
Peters Drumstick Minis Vanilla Ice Cream 6 pack,Frozen
Streets Golden Gaytime Ice Cream Sticks 4 pack,Frozen
Natures Nutrients Frozen Chopped Spinach,Frozen
Frozen Potato French Fries,Frozen
Frozen Peas,Frozen
Frozen Fruit Blueberries,Frozen
Frozen Carrots Corn & Peas,Frozen
Peters Drumstick Vanilla Ice Cream 4 pack,Frozen
Frozen Broccoli Florets,Frozen
Four'N Twenty Frozen Meat Pies 4 Pack,Frozen
Bulla Splits Multi Flavoured Ice Cream Sticks 10 pack,Frozen
Frozen Hash Browns Potatoes,Frozen
Frozen Corn Kernels,Frozen
Frozen Fruit Raspberries,Frozen
Zooper Dooper 8 Cosmic Flavours Water Ice 70mL Tubes,Frozen
Drumstick Ice Cream Super Choc 4Pack,Frozen
Drumstick Boysenberry Ice Cream 4 pack,Frozen
KB Tempura Prawns,Frozen
Bulla Crunch Multi Flavoured Ice Cream Sticks 8 pack,Frozen
Frozen Fruit Mango,Frozen
Cotton Make-Up Pads Round,Health & Self Care
Neutrogena Oil Free Acne Wash Pink Grapefruit Facial Cleanser,Health & Self Care
Gillette Venus Deluxe Smooth Sensitive Women's Razor +2 Blade,Health & Self Care
Always Discreet Normal Incontinence Pads,Health & Self Care
Schick  Hydro Silk Razor & Blade Kit,Health & Self Care
First Response Pregnancy Test Instream,Health & Self Care
Oral B Pro 1500 Electric Toothbrush With Travel Case,Health & Self Care
Libra Goodnights Extra Long With Wings Pads,Health & Self Care
Libra Original Regular Tampons,Health & Self Care
Dove Triple Moisturising Body Wash,Health & Self Care
U by Kotex Ultrathin Pads Regular With Wings,Health & Self Care
U by Kotex Ultrathin Pads Super With Wings,Health & Self Care
Colgate Total Advanced Clean Toothpaste,Health & Self Care
Listerine Freshburst Antibacterial Mouthwash,Health & Self Care
U by Kotex Ultrathin Overnight Pads Long With Wings,Health & Self Care
Colgate Total Advanced Fresh Multi Benefit Toothpaste,Health & Self Care
U by Kotex Extra Overnight Pads Long With Wings,Health & Self Care
Cotton Wool Tips Paper Stem,Health & Self Care
Panadol Rapid Caplets for Pain Relief Paracetamol 500mg,Health & Self Care
U By Kotex Ultrathin Overnight Pads With Wings,Health & Self Care
Paracetamol Caplets,Health & Self Care
U By Kotex Extra Overnight Pads With Wings,Health & Self Care
Libra Pads Ultra Thin Regular Wings,Health & Self Care
Colgate Multi Benefit Advanced Whitening Toothpaste,Health & Self Care
Libra Pads Ultra Thin Super Wing,Health & Self Care
U by Kotex Designer Series Pads Regular With Wings,Health & Self Care
Ibuprofen Tablets 200mg,Health & Self Care
Swisspers Cotton Round Make Up Pads,Health & Self Care
Biodegradable Sensitive 3 In 1 Facial Cleansing Wipes,Health & Self Care
Libra Goodnights Ultra Thin Pads,Health & Self Care
Australian Full Cream Long Life Milk,Drinks
Pepsi Soft Drink Pepsi Cola Max,Drinks
Schweppes Lemonade Soft Drink 24x375mL,Drinks
Schweppes Sunkist Zero Sugar Soft Drink,Drinks
Pepsi Max Soft Drink 375mL Can,Drinks
Solo Original Lemon Thirst Crusher Multipack Cans 375mL,Drinks
Coca-Cola Classic Soft Drink Multipack Cans 10 x 375mL,Drinks
Coca-Cola No Sugar Soft Drink Multipack Cans 10 x 375mL,Drinks
Mount Franklin Lightly Sparkling Water Watermelon,Drinks
Pop Tops Apple Blackcurrant Fruit Drink Multipack 250mL,Drinks
Spring Water 24X600Ml,Drinks
Soda Water,Drinks
Natural Mineral Water,Drinks
Coca-Cola Classic Soft Drink Bottle,Drinks
Natural Spring Water,Drinks
Coca-Cola No Sugar Soft Drink Bottle,Drinks
Mount Franklin Spring Water Bottle,Drinks
Australian Lite Long Life Milk,Drinks
Pump Spring Water Bottle,Drinks
Coca-Cola Classic Soft Drink Bottle,Drinks
Devondale Full Cream Long Life Milk,Drinks
Sanitarium So Good Long Life Regular Soy Milk,Drinks
Australian Skim Long Life Milk,Drinks
Pepsi Max Soft Drink,Drinks
Nudie Pulp Free Oranges Juice Chilled,Drinks
Natural Spring Water 350mL,Drinks
Full Cream Milk Powder,Drinks
Pepsi Max Cola,Drinks
Golden Circle Mango Nectar,Drinks
Schweppes Lemon Lime Bitters Soda Mixers,Drinks
Nudie Pulp Oranges Juice Chilled,Drinks
Lactose Free Long Life Full Cream Milk,Drinks
Drink Soy Regular,Drinks
Coca-Cola Classic Soft Drink Multipack Cans 30 x 375mL,Drinks
Spring Water 8x1.5L,Drinks
Sanitarium So Good Long Life Unsweetened Almond Milk,Drinks
Golden Circle 100% Apple Juice No Added Sugar Fruit Juice,Drinks
Coca-Cola No Sugar Soft Drink Bottle,Drinks
Apple Juice,Drinks
Bonsoy Soy Milk,Drinks
Pepsi Soft Drink Pepsi Cola Max,Drinks
Coca-Cola No Sugar Soft Drink Multipack Cans 30 x 375mL,Drinks
Lactose Free UHT Low Fat Milk,Drinks
V Energy Drink Can,Drinks
Orange Juice,Drinks
Vitasoy UHT Oat Milk,Drinks
Coca-Cola No Sugar Soft Drink Multipack Cans 10 x 375mL,Drinks
Orange Juice Chilled,Drinks
Coca-Cola Classic Soft Drink Multipack Mini Cans 6x250mL,Drinks
Devondale Full Cream Long Life Milk 6 pack,Drinks
Diet Lemonade Soft Drink,Drinks
Sanitarium So Good Long Life Original Almond Milk,Drinks
Daily Juice Pulp Free No Added Sugar Orange Juice,Drinks
Orange Juice Chilled,Drinks
Devondale Semi Skim Long Life Milk,Drinks
Nudie Double Pulp Orange Juice Chilled,Drinks
Schweppes Lemonade,Drinks
Mount Franklin Lightly Sparkling Water Lime,Drinks
Coca-Cola No Sugar Soft Drink Multipack Mini Cans 6x250mL,Drinks
Lipton Peach Ice Tea,Drinks
Devondale Moo Chocolate Flavoured Multipack Milk 200mL,Drinks
Schweppes Tonic Water Mixers,Drinks
Original Juice Co. Black Label Chilled Orange Juice,Drinks
Que Cola Soft Drink,Drinks
Schweppes Agrum Blood Orange Mixers,Drinks
Apple Juice,Drinks
Natural Coconut Water,Drinks
Water 12x600mL,Drinks
Bundaberg Ginger Beer Bottles 375mL,Drinks
Red Bull Energy Drink 4X250mL,Drinks
Coca-Cola Classic Soft Drink Multipack Cans 10 x 375mL,Drinks
Sprite Lemonade Soft Drink Bottle,Drinks
Sprite Lemonade Soft Drink Bottle,Drinks
Gatorade Berry No Sugar Sport Drink,Drinks
Gatorade Fierce Grape Sport Drink,Drinks
Water Spring Natural,Drinks
Golden Circle 100% Orange Juice No Added Sugar Fruit Juices Oj,Drinks
Gatorade Orange Ice Sports Drink,Drinks
Nescafe Strong Cappuccino Coffee Sachets,Drinks
Nescafe Cappuccino Coffee Sachets,Drinks
The Juice Brothers Orange Juice,Drinks
Mount Franklin Lightly Sparkling Water Natural,Drinks
RSPCA Approved Chicken Breast Fillets Large Pack,Meat & Seafood
Tassal Salmon Portions Skin On,Meat & Seafood
Tassal Fresh Tassie Salmon Portions Skin Off,Meat & Seafood
Primo Gourmet Caramelised Onion Pork Sausage,Meat & Seafood
Primo Gourmet World Flavours German Bratwurst Sausage,Meat & Seafood
Primo Beef With Cracked Black Pepper,Meat & Seafood
Primo Gourmet Beef & Pork Chorizo Sausage,Meat & Seafood
Primo Pork With Caramelised Garlic Chives Sausages,Meat & Seafood
Primo Gourmet World Flavours South African Boerewors,Meat & Seafood
Huon Premium Cold Smoked Salmon,Meat & Seafood
Deli Fresh Tasmanian Salmon Portions Skin On,Meat & Seafood
Beef 3 Star Regular Mince,Meat & Seafood
Beef 4 Star Lean Mince,Meat & Seafood
RSPCA Approved Chicken Thigh Fillets Large Pack,Meat & Seafood
Tasmanian Salmon Portions Skin On,Meat & Seafood
Pork Regular Mince,Meat & Seafood
Pork & Beef 3 Star Mince Bolognese,Meat & Seafood
RSPCA Approved Chicken Drumsticks Large Pack,Meat & Seafood
Beef 5 Star Extra Lean Mince,Meat & Seafood
Deli RSPCA Approved Chicken Breast Fillets,Meat & Seafood
Beef 3 Star Regular Mince,Meat & Seafood
RSPCA Approved Free Range Chicken Breast Large Pack,Meat & Seafood
Luv A Duck Frozen Whole Duck,Meat & Seafood
Lilydale Free Range Chicken Breast Fillets Bulk Pack,Meat & Seafood
Beef 4 Star Lean Mince,Meat & Seafood
RSPCA Approved Chicken Breast Fillets Small Pack,Meat & Seafood
Deli RSPCA Approved Chicken Thigh Fillets,Meat & Seafood
Deli Thawed Raw Peeled Prawn Meat,Meat & Seafood
Free Range RSPCA Approved Chicken Drumsticks,Meat & Seafood
RSPCA Approved Chicken Breast Mince,Meat & Seafood
Lilydale Free Range Chicken Drumsticks Bulk Pack,Meat & Seafood
RSPCA Approved Chicken Mince,Meat & Seafood
The Original Beef Sausages,Meat & Seafood
Deli Thawed Raw Black Tiger Prawns,Meat & Seafood
Tasmanian Salmon Portions Skin Off,Meat & Seafood
Butcher Lamb Leg Roast Boneless,Meat & Seafood
Thawed Seafood Marinara Mix,Meat & Seafood
RSPCA Approved Free Range Chicken Thigh Large Pack,Meat & Seafood
RSPCA Approved Free Range Chicken Whole,Meat & Seafood
Butcher Lamb Forequarter Chops,Meat & Seafood
RSPCA Approved Chicken Wing Nibbles,Meat & Seafood
Butcher Lamb Forequarter Chops,Meat & Seafood
Deli Thawed Cooked Vannamei Prawns,Meat & Seafood
No Added Hormone Beef Quick Cook Scotch Fillet Steak,Meat & Seafood
Lamb Cutlets,Meat & Seafood
Deli RSPCA Approved Chicken Drumsticks,Meat & Seafood
Extra Lean Pork Mince,Meat & Seafood
Deli Thawed Australian MSC Raw Banana Prawns,Meat & Seafood
Chicken Sage And Thyme Sausages,Meat & Seafood
RSPCA Approved Free Range Chicken Wing Nibbles,Meat & Seafood
RSPCA Approved Chicken Tenderloins,Meat & Seafood
No Added Hormone Beef Porterhouse Steak 2 Pack,Meat & Seafood
No Added Hormone Beef Sandwich Steak,Meat & Seafood
Lilydale Free Range Chicken Breast Fillets Small Pack,Meat & Seafood
RSPCA Approved Medium Whole Chicken,Meat & Seafood
Lilydale Free Range Chicken Tenderloins,Meat & Seafood
Deli Thawed Basa Fillets,Meat & Seafood
Farms Beef Mince Family Pack,Meat & Seafood
Lamb Cutlets,Meat & Seafood
Lamb Leg Roast Half,Meat & Seafood
Beef Sizzle Steak,Meat & Seafood
Pork Spare Ribs Rr 11X9 Large Tray,Meat & Seafood
Beef Stir Fry Strips,Meat & Seafood
Beef Eye Fillet Steak,Meat & Seafood
Beef Chuck Casserole Steak,Meat & Seafood
RSPCA Approved Extra Large Whole Chicken,Meat & Seafood
Lilydale Free Range Whole Chicken,Meat & Seafood
No Added Hormone Beef Rump Medallions,Meat & Seafood
Beef Garlic & Herb Sausages,Meat & Seafood
Beef Fillet Steak Small,Meat & Seafood
Quick Cook Pork Belly Slices,Meat & Seafood
Graze Grass Fed Beef Mince,Meat & Seafood
Tasmanian Salmon Portions Skin On,Meat & Seafood
Steggles Turkey Mince,Meat & Seafood
No Added Hormone Beef Scotch Fillet Thin Sliced,Meat & Seafood
No Added Hormone Beef Quick Cook Porterhouse  Steak,Meat & Seafood
Lilydale Chicken Breast Schnitzels,Meat & Seafood
RSPCA Approved Chicken Thigh Fillets Small Pack,Meat & Seafood
Pork Ribs BBQ,Meat & Seafood
Beef Scotch Steak Fillet 2 Pack,Meat & Seafood
Pork Forequarter Cutlets,Meat & Seafood
Tasmanian Salmon Portions Skin Off,Meat & Seafood
Tassal Tasmanian Smoked Salmon,Meat & Seafood
Butcher Lamb Loin Chops,Meat & Seafood
Lamb Leg Steak 2 Pack,Meat & Seafood
Ocean Blue Sliced Smoked Salmon,Meat & Seafood
RSPCA Approved Chicken Breast Schnitzel Plain Crumb,Meat & Seafood
No Added Hormone Beef Scotch Steak With Truffle Butter,Meat & Seafood
Deli Fresh Tasmanian Salmon Portions Skin Off,Meat & Seafood
RSPCA Approved Chicken Breast Schnitzel Garlic & Herb Crumb,Meat & Seafood
Graze Grassfed Beef Scotch Fillet Steak,Meat & Seafood
Boneless Pork Leg Roast,Meat & Seafood
Deli Thawed Barramundi Fillets,Meat & Seafood
Pork Sirloin Steak,Meat & Seafood
RSPCA Approved Chicken V Wings,Meat & Seafood
Gluten Free Beef Burgers Graze Grass Fed Oregano & Fresh Parsley,Meat & Seafood
Deli Fresh Australian Cooked Black Tiger Prawns,Meat & Seafood
Pork Sausage,Meat & Seafood
Pork Spare Ribs,Meat & Seafood
Beef & Pork Meatballs Classic 28 Pack,Meat & Seafood
Deli Thawed Cooked Prawn Plate Small,Meat & Seafood
RSPCA Approved Free Range Chicken Lovely Legs,Meat & Seafood
